{
  "allowed_features": [
    "mom_ret_1d",
    "liq_volume_ratio_5",
    "style_beta_20",
    "style_idio_vol_20"
  ],
  "allowed_operators": [
    "add",
    "subtract",
    "multiply",
    "divide",
    "rolling_mean",
    "rolling_std",
    "rolling_min",
    "rolling_max",
    "delta",
    "cs_rank",
    "cs_zscore"
  ],
  "allowed_parameter_roles": [
    "lookback_window",
    "factor_internal_weight"
  ],
  "constraints": [
    "no lookahead or future data",
    "no executable extension",
    "no target data or frozen evidence",
    "adaptive 2025 development only",
    "no prediction or promotion claim",
    "at least one declared parameter used in the AST and searched under the formal role contract",
    "constant-only templates are forbidden",
    "maximum two proposals and one admitted template"
  ],
  "dataset_kind": "legacy_feature_matrix_v1",
  "goal_id": "rg_decb8ade35d283ef078368da5d7c05e5c2c91a08b919debdf3a9208c21bf3109",
  "maximum_iterations": 1,
  "maximum_templates": 1,
  "maximum_trials": 6,
  "name": "artifact_backed_external_agent_parameter_aligned_success_path_v4",
  "novelty_requirement": "structurally distinct from all canonical Registry families; names, defaults, bound values, constant-only forms, and commutative reorderings are not novel",
  "objective": "Propose one fully parameter-bound, non-placeholder Factor DSL structure through the Provider-compatible explicit-values profile, structurally distinct from every canonical Registry family and limited to contaminated 2025 development research.",
  "schema_version": "1.0.0"
}
